{
  "authority_effect": "none",
  "max_outputs_per_batch": 8,
  "reviewer_batches": [
    {
      "batch_id": "reviewer-a-batch-01",
      "items": [
        {
          "arm": "baseline",
          "blind_alias": "0ae00008b968d0c3",
          "case_id": "ii-actor-attribution-1",
          "repetition": 1
        },
        {
          "arm": "baseline",
          "blind_alias": "438037f538efa1da",
          "case_id": "ii-quotation-2",
          "repetition": 1
        },
        {
          "arm": "baseline",
          "blind_alias": "d0fb31e216653f60",
          "case_id": "ii-counterfactual-1",
          "repetition": 1
        },
        {
          "arm": "baseline",
          "blind_alias": "a9d183aef28171ce",
          "case_id": "ii-correction-rejection-2",
          "repetition": 1
        },
        {
          "arm": "baseline",
          "blind_alias": "c0c2e543658f9b46",
          "case_id": "ii-evidence-status-1",
          "repetition": 1
        },
        {
          "arm": "baseline",
          "blind_alias": "5939999b478ffdcd",
          "case_id": "ii-agent-added-frame-2",
          "repetition": 1
        },
        {
          "arm": "baseline",
          "blind_alias": "14a1fc6b5abd6e1f",
          "case_id": "ii-underdetermined-1",
          "repetition": 1
        },
        {
          "arm": "baseline",
          "blind_alias": "9f3a696e7ba1d392",
          "case_id": "ii-safety-2",
          "repetition": 1
        }
      ],
      "reviewer_alias": "reviewer-a"
    },
    {
      "batch_id": "reviewer-a-batch-02",
      "items": [
        {
          "arm": "baseline",
          "blind_alias": "e715dc86e8be96d5",
          "case_id": "ii-actor-attribution-2",
          "repetition": 1
        },
        {
          "arm": "baseline",
          "blind_alias": "13c86708c9cd1b09",
          "case_id": "ii-joke-hyperbole-1",
          "repetition": 1
        },
        {
          "arm": "baseline",
          "blind_alias": "e40e6506a119d33c",
          "case_id": "ii-counterfactual-2",
          "repetition": 1
        },
        {
          "arm": "baseline",
          "blind_alias": "7b841e45124dbb73",
          "case_id": "ii-qualification-1",
          "repetition": 1
        },
        {
          "arm": "baseline",
          "blind_alias": "77991d947c7cd780",
          "case_id": "ii-evidence-status-2",
          "repetition": 1
        },
        {
          "arm": "baseline",
          "blind_alias": "96add8e4600dd864",
          "case_id": "ii-clear-request-1",
          "repetition": 1
        },
        {
          "arm": "baseline",
          "blind_alias": "bf3074a28c8bc3c2",
          "case_id": "ii-underdetermined-2",
          "repetition": 1
        },
        {
          "arm": "baseline",
          "blind_alias": "ec579d4cac7321f7",
          "case_id": "ii-deliberate-change-1",
          "repetition": 1
        }
      ],
      "reviewer_alias": "reviewer-a"
    },
    {
      "batch_id": "reviewer-a-batch-03",
      "items": [
        {
          "arm": "baseline",
          "blind_alias": "5d7178367ff4ba8c",
          "case_id": "ii-quotation-1",
          "repetition": 1
        },
        {
          "arm": "baseline",
          "blind_alias": "53ef0a08f183ac5a",
          "case_id": "ii-joke-hyperbole-2",
          "repetition": 1
        },
        {
          "arm": "baseline",
          "blind_alias": "372d2e03bbf262f4",
          "case_id": "ii-correction-rejection-1",
          "repetition": 1
        },
        {
          "arm": "baseline",
          "blind_alias": "3b4620706105d7ba",
          "case_id": "ii-qualification-2",
          "repetition": 1
        },
        {
          "arm": "baseline",
          "blind_alias": "387751e64ee198b9",
          "case_id": "ii-agent-added-frame-1",
          "repetition": 1
        },
        {
          "arm": "baseline",
          "blind_alias": "c6413329f65a703e",
          "case_id": "ii-clear-request-2",
          "repetition": 1
        },
        {
          "arm": "baseline",
          "blind_alias": "71a2cdd58a407f15",
          "case_id": "ii-safety-1",
          "repetition": 1
        },
        {
          "arm": "baseline",
          "blind_alias": "821f95b9fe4742ba",
          "case_id": "ii-deliberate-change-2",
          "repetition": 1
        }
      ],
      "reviewer_alias": "reviewer-a"
    },
    {
      "batch_id": "reviewer-a-batch-04",
      "items": [
        {
          "arm": "compact-invariant",
          "blind_alias": "7e43457e5969e31f",
          "case_id": "ii-actor-attribution-1",
          "repetition": 1
        },
        {
          "arm": "compact-invariant",
          "blind_alias": "fcf32a9a57964698",
          "case_id": "ii-quotation-2",
          "repetition": 1
        },
        {
          "arm": "compact-invariant",
          "blind_alias": "d62bd04de83474f5",
          "case_id": "ii-counterfactual-1",
          "repetition": 1
        },
        {
          "arm": "compact-invariant",
          "blind_alias": "40568e7e1deb1147",
          "case_id": "ii-correction-rejection-2",
          "repetition": 1
        },
        {
          "arm": "compact-invariant",
          "blind_alias": "3ca8c57f51bb53d8",
          "case_id": "ii-evidence-status-1",
          "repetition": 1
        },
        {
          "arm": "compact-invariant",
          "blind_alias": "fb5bb442c4db6fcb",
          "case_id": "ii-agent-added-frame-2",
          "repetition": 1
        },
        {
          "arm": "compact-invariant",
          "blind_alias": "a98fbd505cb44eb3",
          "case_id": "ii-underdetermined-1",
          "repetition": 1
        },
        {
          "arm": "compact-invariant",
          "blind_alias": "a95daf642ae997a1",
          "case_id": "ii-safety-2",
          "repetition": 1
        }
      ],
      "reviewer_alias": "reviewer-a"
    },
    {
      "batch_id": "reviewer-a-batch-05",
      "items": [
        {
          "arm": "compact-invariant",
          "blind_alias": "36353a58205226a2",
          "case_id": "ii-actor-attribution-2",
          "repetition": 1
        },
        {
          "arm": "compact-invariant",
          "blind_alias": "619182fc70233016",
          "case_id": "ii-joke-hyperbole-1",
          "repetition": 1
        },
        {
          "arm": "compact-invariant",
          "blind_alias": "e15fe973365e8c19",
          "case_id": "ii-counterfactual-2",
          "repetition": 1
        },
        {
          "arm": "compact-invariant",
          "blind_alias": "6b96554d34f1d34c",
          "case_id": "ii-qualification-1",
          "repetition": 1
        },
        {
          "arm": "compact-invariant",
          "blind_alias": "6c059844c48b4f90",
          "case_id": "ii-evidence-status-2",
          "repetition": 1
        },
        {
          "arm": "compact-invariant",
          "blind_alias": "dabb3496602ef7f2",
          "case_id": "ii-clear-request-1",
          "repetition": 1
        },
        {
          "arm": "compact-invariant",
          "blind_alias": "d249e4644afb4ab3",
          "case_id": "ii-underdetermined-2",
          "repetition": 1
        },
        {
          "arm": "compact-invariant",
          "blind_alias": "29ee8b3293c821ab",
          "case_id": "ii-deliberate-change-1",
          "repetition": 1
        }
      ],
      "reviewer_alias": "reviewer-a"
    },
    {
      "batch_id": "reviewer-a-batch-06",
      "items": [
        {
          "arm": "compact-invariant",
          "blind_alias": "0258e953fa34fda9",
          "case_id": "ii-quotation-1",
          "repetition": 1
        },
        {
          "arm": "compact-invariant",
          "blind_alias": "ee317fd96184ff19",
          "case_id": "ii-joke-hyperbole-2",
          "repetition": 1
        },
        {
          "arm": "compact-invariant",
          "blind_alias": "131e73683bfac858",
          "case_id": "ii-correction-rejection-1",
          "repetition": 1
        },
        {
          "arm": "compact-invariant",
          "blind_alias": "ec64b8ef49c2bcc1",
          "case_id": "ii-qualification-2",
          "repetition": 1
        },
        {
          "arm": "compact-invariant",
          "blind_alias": "6a855f4635158003",
          "case_id": "ii-agent-added-frame-1",
          "repetition": 1
        },
        {
          "arm": "compact-invariant",
          "blind_alias": "fb993e3491f38f2e",
          "case_id": "ii-clear-request-2",
          "repetition": 1
        },
        {
          "arm": "compact-invariant",
          "blind_alias": "bcbff90c39804b6b",
          "case_id": "ii-safety-1",
          "repetition": 1
        },
        {
          "arm": "compact-invariant",
          "blind_alias": "571a9b059091787c",
          "case_id": "ii-deliberate-change-2",
          "repetition": 1
        }
      ],
      "reviewer_alias": "reviewer-a"
    },
    {
      "batch_id": "reviewer-a-batch-07",
      "items": [
        {
          "arm": "baseline",
          "blind_alias": "6ee094f1efca1841",
          "case_id": "ii-actor-attribution-1",
          "repetition": 2
        },
        {
          "arm": "baseline",
          "blind_alias": "4bb00c5583cd97b6",
          "case_id": "ii-quotation-2",
          "repetition": 2
        },
        {
          "arm": "baseline",
          "blind_alias": "374e34ed861f164e",
          "case_id": "ii-counterfactual-1",
          "repetition": 2
        },
        {
          "arm": "baseline",
          "blind_alias": "a1658ab5e740fed0",
          "case_id": "ii-correction-rejection-2",
          "repetition": 2
        },
        {
          "arm": "baseline",
          "blind_alias": "8f7da33ffd277c2f",
          "case_id": "ii-evidence-status-1",
          "repetition": 2
        },
        {
          "arm": "baseline",
          "blind_alias": "424bd51d6bcae1cf",
          "case_id": "ii-agent-added-frame-2",
          "repetition": 2
        },
        {